{
  "version": "v1",
  "trace_id": "trace_home_benefits_01",
  "request_id": "req_home_benefits_01",
  "today": "2026-02-24",
  "count": 3,
  "total_count": 5,
  "limit": 12,
  "items": [
    {
      "item_id": 10,
      "benefit_code": "CARD_LOTTE_04",
      "badge": "카드",
      "title": "카드 결제 4% 즉시 할인",
      "description": "일부 카드 결제 시 즉시 할인이 적용됩니다.",
      "discount_type": "PERCENT",
      "discount_value": 4,
      "discount_label": "4% 할인 (최대 10,000원)",
      "min_order_amount": 10000,
      "min_order_amount_label": "10,000원",
      "max_discount_amount": 10000,
      "max_discount_amount_label": "10,000원",
      "valid_from": "2026-02-23T00:00:00Z",
      "valid_to": "2026-03-02T23:59:59Z",
      "daily_limit": null,
      "remaining_daily": null,
      "link_url": "/benefits",
      "cta_label": "혜택 받기"
    },
    {
      "item_id": 20,
      "benefit_code": "PAY_KAKAOPAY_4000",
      "badge": "간편결제",
      "title": "간편결제 4,000원 즉시 할인",
      "description": "결제 수단별 선착순 혜택입니다.",
      "discount_type": "FIXED",
      "discount_value": 4000,
      "discount_label": "4,000원 즉시 할인",
      "min_order_amount": 25000,
      "min_order_amount_label": "25,000원",
      "max_discount_amount": null,
      "max_discount_amount_label": null,
      "valid_from": "2026-02-23T00:00:00Z",
      "valid_to": "2026-02-25T23:59:59Z",
      "daily_limit": 500,
      "remaining_daily": 183,
      "link_url": "/benefits",
      "cta_label": "혜택 받기"
    },
    {
      "item_id": 40,
      "benefit_code": "CARD_NH_2500",
      "badge": "카드",
      "title": "특정 카드 결제 2,500원 할인",
      "description": "조건 충족 시 결제 단계에서 자동 적용됩니다.",
      "discount_type": "FIXED",
      "discount_value": 2500,
      "discount_label": "2,500원 즉시 할인",
      "min_order_amount": 30000,
      "min_order_amount_label": "30,000원",
      "max_discount_amount": null,
      "max_discount_amount_label": null,
      "valid_from": "2026-02-23T00:00:00Z",
      "valid_to": "2026-03-02T23:59:59Z",
      "daily_limit": null,
      "remaining_daily": null,
      "link_url": "/benefits",
      "cta_label": "혜택 받기"
    }
  ]
}
